{
  "app": "your-app-name",
  "version": "1.0.0",
  "lastUpdated": "2026-05-09",
  "brand": {
    "name": "Your App",
    "tagline": "Your tagline here",
    "accentColor": "#F59E0B",
    "darkBg": "#0a0f1e",
    "fontFamily": "Inter, system-ui, sans-serif",
    "logoFile": "public/assets/brand/logo.svg"
  },
  "images": [
    { "id": "hero-screenshot", "file": "public/assets/screenshots/hero.png", "description": "Main app screen", "approved": true, "channels": ["landing-page","app-store","social"] }
  ],
  "voice": [
    { "id": "founder-vo", "file": "public/assets/voice/founder-voiceover.mp3", "description": "Founder voiceover", "approved": true, "elevenLabsVoiceId": null }
  ],
  "copy": [
    { "id": "hero-headline", "text": "Your headline here", "channel": "landing-page", "approved": true }
  ],
  "videos": [
    { "id": "screen-recording-v1", "file": "public/assets/video/screen-recording-v1.mp4", "description": "Raw screen recording", "approved": true }
  ]
}
